Valdemar Tomaševski: Minority Rights,08-03-2011,European Parliament,Martin Callanan,923,"<p>
	</p><p>The topic of today’s session is widely spread in Lithuania despite the fact that in most member states the problems of national minorities in general do not exist as they were simply solved. The States of West democracy hammered out two basic documents regulating the rights of national minorities, namely the European Charter for Regional or Minority Languages and the Framework Convention for the Protection of National Minorities. </p><p>
</p><p>The road was already put ahead for the states of central-eastern Europe, thus they did not need to discover anything but just to approve the documents and implement them into live. Moreover, after signing the Framework Convention for the Protection of National Minorities in 2000 Lithuania had to ratify it as well. It seemed that all the problems of national minorities had to disappear from the docket of problems until that time. Unfortunately, today at the end of 2009 the problems not only did not diminish, but even the regress was noticed in the rights that had been acquired in 20 century.</p><p>
</p><p>The fact that in the meantime in 2004 Lithuania joined the European Union should be mentioned as crucial as well. Such a paradoxical situation was difficult to predict even for a person of extraordinary political intuition. Unfortunately, the truth is that today, as a national minority in Lithuania, we have less rights in comparison to the period of the first years of  independency of Lithuania, which was gained in 1991. I will present some examples to prove my words.</p><p>
</p><p>In 1991, under the amendments of Lithuanian Law on National Minorities the minorities obtained the right to use their vernacular language alongside the state language in public life in the places of their compact concentrations. In some districts and communes bilingual (usually in the state language Lithuanian and in Polish) street name plates, informative inscriptions appeared. Such solution was really logical. After all, the Polish national minority in two districts of Vilnius and more than 40 communes constitutes 60-90% of all the inhabitants.</p><p>
</p><p>Unfortunately, the Lithuanian politicians opposite to such solution ignoring the above mentioned Lithuanian law, Framework Convention, and the Treaty of Accession, initiated a number of legal actions demanding the removal of bilingual inscriptions in Vilnius districts in 2008. It may seem strange, but the Supreme Administrative Court of the Republic of Lithuania satisfied the unfavourable to national minorities’ demands of the politicians and gave a ruling ordering to remove the bilingual plates.</p><p>
</p><p>Local communities are not able to reconcile with it, people do not allow to remove the inscriptions from their houses. Authorities drew the state administration and even bailiffs into the conflict, who threatening with fines force to remove the tables. The situation cannot be called differently than scandalous. In the opinion of local inhabitants the situation is just lawless. It is extremely difficult to dispute such opinion, people do not understand why after our accession to the European Union in 2004 their rights as minorities are suddenly depleted. Such situation does not add any authority to the European Union. Thus, this misunderstanding should be resolved as soon as possible.</p><p>
</p><p>There is another topic crucial for national minorities. Namely, the education system. Unfortunately, a clear regression is noted in this sphere as well. Here is an example of the last minute – funding for schools of national minorities has been reduced by 5 percent this year. A year ago, the minimal number of students in the classes of national minorities schools has been dramatically increased, which can lead to the closure of half of the schools of national minorities. Even earlier, the compulsory examination of the vernacular language was liquidated in the schools of national minorities. In Lithuanian government, despite the national minority protests, the projects to introduce a compulsory teaching of half or even more subjects in the schools of national minorities in the language other than vernacular are in progress.</p><p>
</p><p>A third example of a clear regress in the rights of national minorities is the hampering of the minority participation in political life. And however there are no standards concerning the application of the electoral threshold for ethnic minorities in Europe, it should be noted that the introduction of such a threshold for the national minority organizations in 1996 was a scheduled step intended to weaken the minority organisations. For example, in 1992 in already independent Lithuania there was no threshold for national minorities and the Association of Poles in Lithuania (APL), registered in the nationwide list, gained 2.1% and two mandates as a result. Two more mandates were gained in the single mandate constituencies.</p><p>
</p><p>The threshold was introduced in 1996 and a list of EAPL received 3 percent of votes but gained no mandates at all. In 2008 it gained 4.8% and the electoral threshold deprived it of 5 seats. EAPL gained only three seats in single-mandate constituencies. The constituencies were formed in a particular way in order to impede the victory of the representatives of national minorities in the constituencies. Thus part of the Vilnius, Šalčininkai districts where Poles constitute even 80 percent of all voters, were annexed to neighbouring districts, where Poles constitute only a small amount of the residents. That is how it looks in practice – a national minority candidate in an electoral constituency of e.g. Varėna-Eišiškės may gain 80 percent of votes in ¼ of the constituency, while in a whole constituency he is doomed to failure.</p><p>
</p><p>We have to clearly and firmly speak about the inappropriate attitude towards national minorities, as such problems should not exist in the European Union. I sincerely hope that today’s session will not only be helpful in exposure of these problems but also in their solution</p><p>
    </p>",topic today session wide spread lithuania despit fact member state problem nation minor general exist simpli solv state west democraci hammer two basic document regul right nation minor name european charter region minor languag framework convent protect nation minor road alreadi put ahead state centraleastern europ thus need discov anyth approv document implement live moreov sign framework convent protect nation minor lithuania ratifi well seem problem nation minor disappear docket problem time unfortun today end problem diminish even regress notic right acquir centuri fact meantim lithuania join european union mention crucial well paradox situat difficult predict even person extraordinari polit intuit unfortun truth today nation minor lithuania less right comparison period first year independ lithuania gain present exampl prove word amend lithuanian law nation minor minor obtain right use vernacular languag alongsid state languag public life place compact concentr district commune bilingu usual state languag lithuanian polish street name plate inform inscript appear solut realli logic polish nation minor two district vilnius commune constitut inhabit unfortun lithuanian politician opposit solut ignor mention lithuanian law framework convent treati access initi number legal action demand remov bilingu inscript vilnius district may seem strang suprem administr court republ lithuania satisfi unfavour nation minor demand politician gave rule order remov bilingu plate local communiti abl reconcil peopl allow remov inscript hous author drew state administr even bailiff conflict threaten fine forc remov tabl situat cannot call differ scandal opinion local inhabit situat lawless extrem difficult disput opinion peopl understand access european union right minor sudden deplet situat add author european union thus misunderstand resolv soon possibl anoth topic crucial nation minor name educ system unfortun clear regress note sphere well exampl last minut fund school nation minor reduc percent year year ago minim number student class nation minor school dramat increas lead closur half school nation minor even earlier compulsori examin vernacular languag liquid school nation minor lithuanian govern despit nation minor protest project introduc compulsori teach half even subject school nation minor languag vernacular progress third exampl clear regress right nation minor hamper minor particip polit life howev standard concern applic elector threshold ethnic minor europ note introduct threshold nation minor organ schedul step intend weaken minor organis exampl alreadi independ lithuania threshold nation minor associ pole lithuania apl regist nationwid list gain two mandat result two mandat gain singl mandat constitu threshold introduc list eapl receiv percent vote gain mandat gain elector threshold depriv seat eapl gain three seat singlemand constitu constitu form particular way order imped victori repres nation minor constitu thus part vilnius šalčininkai district pole constitut even percent voter annex neighbour district pole constitut small amount resid look practic nation minor candid elector constitu e g varėnaeišiškė may gain percent vote ¼ constitu whole constitu doom failur clear firm speak inappropri attitud toward nation minor problem exist european union sincer hope today session help exposur problem also solut,en
"Speech to enlarged Conference of Presidents with European Council President Van Rompuy, by Timothy Kirkhope MEP",08-02-2011,European Parliament,Martin Callanan,554,"<p>
	</p><p>Freedom is a value shared across this house and for the ECR Group it is one of our most important principles. We believe the maximisation of individual freedom in society with a restricted state and low taxes is the best way to secure the social, economic and political objectives we all seek.</p><p>
</p><p>This is why we welcome developments in Tunisia – which the British Foreign Secretary is visiting today – in Egypt and across the Arab world, and we support the declaration adopted by the European Council last Friday.</p><p>
</p><p>It is a myth perpetrated by those who wish to control their fellow citizens that democracy is incompatible with Islamic faith or inconsistent with Arab culture. Recent events have demonstrated that the peoples of the Arab world have the same desire for freedom and democracy as elsewhere. Repression has stifled economic development – and people in north Africa and much of the middle east have been held down, and held back. Economic progress has been slow, characterised by low growth and high unemployment – a key factor in the recent upheaval. This has made some fall for the appeal of more violent and extremist groups. But if freedom and economic development can be achieved, the vast majority will never take that path.</p><p>
</p><p>We therefore support the process of transition in Egypt. We should however record that President Mubarak has been a great Egyptian patriot, and a friend of Europe and America. By pursuing peace with Israel he has no doubt saved lives. But we can not be blind to the authoritarian nature of his regime. The time has come for change.</p><p>
</p><p>We know from our experiences here in Europe, that democracy has its best chance of success if it can build on a functioning state transformed by careful steps to meet the hopes of the people. And we know too from the revolution in Iran that a brief flicker of freedom can be cruelly snuffed out by one authoritarian regime snatching power from another.</p><p>
</p><p>So careful progress is our hope for the people of Egypt, the middle east, and beyond, including Belarus whose citizens have tragically once again be denied the chance of a free and fair election. And as we support freedom abroad, so we support it at home.</p><p>
</p><p>We welcome the progress made in the European Council to extend the principles of economic freedom enshrined in the single market to the key area of innovation. The creation of a “genuine single market for knowledge, research and innovation” by means of the European Research Area deserves support, as does the Digital Single Market; also an integrated energy market to promote competition and ensure energy security. We must not neglect these key reforms to build a sustainable competitive economy. But let me add a word of caution. It is right to sweep away artificial barriers to trade, research and innovation, but we must resist the temptation to intervene too forcefully in the market by trying to pick winners or impose regulations.</p><p>
</p><p>In this field, as in so many others, governments need to establish the right legal and policy frameworks, provide the right climate and incentives for investment, and then allow businesses, entrepreneurs, inventors and scientists to extend the boundaries of technology and innovation. It is economic freedom, not government intervention, that will open the door to our future prosperity.</p><p>
    </p>",freedom valu share across hous ecr group one import principl believ maximis individu freedom societi restrict state low tax best way secur social econom polit object seek welcom develop tunisia british foreign secretari visit today egypt across arab world support declar adopt european council last friday myth perpetr wish control fellow citizen democraci incompat islam faith inconsist arab cultur recent event demonstr peopl arab world desir freedom democraci elsewher repress stifl econom develop peopl north africa much middl east held held back econom progress slow characteris low growth high unemploy key factor recent upheav made fall appeal violent extremist group freedom econom develop achiev vast major never take path therefor support process transit egypt howev record presid mubarak great egyptian patriot friend europ america pursu peac israel doubt save live blind authoritarian natur regim time come chang know experi europ democraci best chanc success build function state transform care step meet hope peopl know revolut iran brief flicker freedom cruelli snuf one authoritarian regim snatch power anoth care progress hope peopl egypt middl east beyond includ belarus whose citizen tragic deni chanc free fair elect support freedom abroad support home welcom progress made european council extend principl econom freedom enshrin singl market key area innov creation genuin singl market knowledg research innov mean european research area deserv support digit singl market also integr energi market promot competit ensur energi secur must neglect key reform build sustain competit economi let add word caution right sweep away artifici barrier trade research innov must resist temptat interven forc market tri pick winner impos regul field mani other govern need establish right legal polici framework provid right climat incent invest allow busi entrepreneur inventor scientist extend boundari technolog innov econom freedom govern intervent open door futur prosper,en
"Speaking to the Conservative Party Conference in Birmingham, ECR Deputy Chairman and leader of the UK Conservatives in the European Parliament, Timothy Kirkhope MEP, said:",06-10-2010,European Parliament,Martin Callanan,911,"<p>
	</p><p>Speaking to the Conservative Party Conference in Birmingham, ECR Deputy Chairman and leader of the UK Conservatives in the European Parliament, Timothy Kirkhope MEP, said:</p><p>
</p><p>Our new group, the European Conservatives and Reformists, is little more than twelve months old but we can already report on a year of real achievement. David Cameron’s vision of a new political force in European politics is being realised: a movement for reform offering a new vibrant vision of a decentralised, free market Europe respecting the rights of its member states.</p><p>
</p><p>We are now setting a new agenda:</p><p>
•       by leading the campaign to end Parliament’s meetings in Strasbourg;</p><p>
•       by fighting additional burdens of red tape and over-regulation on British businesses;</p><p>
•       by ensuring the City of London get a fair deal in the financial services package;</p><p>
•       by winning arguments against waste and fighting to control the EU budget;</p><p>
And now of course the work of our new group has been reinforced by our new government in the UK. Reform in Europe is gathering momentum. And not before time. It is overdue and desperately needed to meet the global challenges we face.</p><p>
</p><p>For three hundred years, the most economically powerful nations were also the most liberal – countries committed to the rule of law, the rights of individuals, constitutional government and, ultimately, to democracy itself. Together time and again, we were able to defeat the revolutionary and totalitarian threats we faced.</p><p>
</p><p>But things have changed.</p><p>
</p><p>As recently as 1980 the West had over one half of global GDP. Soon it will approach one third – a downward trend that will continue well into this century.</p><p>
</p><p>The reality is that a new kind of state-driven capitalist system in countries like China and Russia now poses a massive challenge.</p><p>
And we also face the ever present danger of those who operate outside the law and the control of any state – pursuing their authoritarian ambitions in the name of religion though terror.</p><p>
</p><p>So we must work towards a world were the benefits of economic growth are shared, but go hand in hand with democratic development.</p><p>
</p><p>What we need is a re-invigorated transatlantic alliance, a renewed Commonwealth, and a re-focused European Union.</p><p>
</p><p>And that is what the European Conservative and Reformist Group is all about: Eurorealism.</p><p>
Your Conservative MEPs are dedicated to this goal and I am proud of the work they have accomplished on your behalf. The ECR has established itself as a pivotal force in the European Parliament and in the other institutions of the European Union. We alone offer a clear message and a coherent programme of reform. And our impact is growing by the day. Our role has been crucial in a range of decisions from the election of the President of the Commission to the development of new initiatives for the internal market.</p><p>
</p><p>Of course we cannot do this alone.</p><p>
</p><p>Coalition-building may be relatively new to all of us today in Britain but it is of course a fact of life in the European Parliament.</p><p>
</p><p>By having clear objectives, a strong voice and a willingness to cooperate, we are winning arguments and rallying support from elsewhere in the Parliament. We have already broken the mould of European politics. We can now rally believers in the free-market across the centre and right of the Parliament to promote vital economic reform.</p><p>
</p><p>The work we are doing in Brussels offers the way forward for Europe that it has so far lacked. We are in the vanguard of an exciting fresh start after literally years of institutional wrangling.</p><p>
</p><p>As well as having experience of coalition-building, we also have experience of dealing every day with backward-looking, old-fashioned socialists with a dangerous belief in an over-powerful role for the state, who are beholden to the vested interests of the public sector and to unrealistic and unreasonable trade unions. Sounds familiar doesn’t it? Ed Miliband would feel quite at home.</p><p>
</p><p>And talking of the Milibands – poor David…. losing to your younger brother….having to step aside from the front bench…Ladies and Gentlemen – that’s got to be the first time a politician has quit to spend less time with his family.</p><p>
</p><p>Ladies & Gentlemen, old-style socialism is back with a vengeance here and across the whole continent. It poses a threat to our economic and political future and so we cannot and must not stand aside: we must ensure that we are equal to the task of defeating it once and for all.</p><p>
******************************</p><p>
</p><p>At last Britain now has again in William Hague a Foreign Secretary respected throughout the world. Ably supported by David Lidington, counterparts across Europe know that we are open to cooperation when it makes sense but will remain firm in the defence of British interests and resolute in defending our political principles.</p><p>
</p><p>And at European summits, David Cameron is transforming the debate there as he has transformed it here – taking the lead:</p><p>
-       on sorting out public finances and building a sustainable economy;</p><p>
-       on promoting international development and the global environment; and</p><p>
-       on expanding economic opportunity and global trade.</p><p>
</p><p>Our Group, our Conservative MEPs, inspired by his vision and beliefs – will support him all the way.</p><p>
</p><p>******************************</p><p>
</p><p>We face enormous challenges in Britain, in Europe, and across the globe. But with commitment and confidence, this can be a time of opportunity – a time to restore our country’s fortunes at home and to re-assert its values throughout the world.</p><p>
</p><p>Ladies & Gentlemen – in Europe and the World, British leadership, Conservative Leadership, is back.</p><p>
    </p>",speak conserv parti confer birmingham ecr deputi chairman leader uk conserv european parliament timothi kirkhop mep said new group european conserv reformist littl twelv month old alreadi report year real achiev cameron vision new polit forc european polit realis movement reform offer new vibrant vision decentralis free market europ respect right member state set new agenda lead campaign end parliament meet strasbourg fight addit burden red tape overregul british busi ensur citi london get fair deal financi servic packag win argument wast fight control eu budget cours work new group reinforc new govern uk reform europ gather momentum time overdu desper need meet global challeng face three hundr year econom power nation also liber countri commit rule law right individu constitut govern ultim democraci togeth time abl defeat revolutionari totalitarian threat face thing chang recent west one half global gdp soon approach one third downward trend continu well centuri realiti new kind statedriven capitalist system countri like china russia pose massiv challeng also face ever present danger oper outsid law control state pursu authoritarian ambit name religion though terror must work toward world benefit econom growth share go hand hand democrat develop need reinvigor transatlant allianc renew commonwealth refocus european union european conserv reformist group euror conserv mep dedic goal proud work accomplish behalf ecr establish pivot forc european parliament institut european union alon offer clear messag coher programm reform impact grow day role crucial rang decis elect presid commiss develop new initi intern market cours cannot alon coalitionbuild may relat new us today britain cours fact life european parliament clear object strong voic willing cooper win argument ralli support elsewher parliament alreadi broken mould european polit ralli believ freemarket across centr right parliament promot vital econom reform work brussel offer way forward europ far lack vanguard excit fresh start liter year institut wrangl well experi coalitionbuild also experi deal everi day backwardlook oldfashion socialist danger belief overpow role state beholden vest interest public sector unrealist unreason trade union sound familiar doesn ed miliband would feel quit home talk miliband poor lose younger brother step asid front bench ladi gentlemen got first time politician quit spend less time famili ladi gentlemen oldstyl social back vengeanc across whole contin pose threat econom polit futur cannot must stand asid must ensur equal task defeat last britain william hagu foreign secretari respect throughout world abli support lidington counterpart across europ know open cooper make sens remain firm defenc british interest resolut defend polit principl european summit cameron transform debat transform take lead sort public financ build sustain economi promot intern develop global environ expand econom opportun global trade group conserv mep inspir vision belief support way face enorm challeng britain europ across globe commit confid time opportun time restor countri fortun home reassert valu throughout world ladi gentlemen europ world british leadership conserv leadership back,en
