"Callanan welcomes Cypriot Presidency, and responds to Barroso’s ‘outburst’",04-07-2012,European Parliament,Martin Callanan,596,"<p>
	</p><p>– Mr President, let me first of all thank President Christofias for his speech today and for the welcome that he gave to my group when we recently visited Cyprus. We greatly appreciated the constructive meetings that we had with him and his government. It is clear that we are not going to have much in common politically, but nevertheless we did appreciate his courtesy and his hospitality. We also agree with the implication in the Presidency’s priorities that the EU is not seen as relevant by many of its citizens, and that it needs to become more effective and more efficient. The position of my group is clear: we do not want to see the EU fail, but if it continues to pursue the agenda of the past then it most surely will.</p><p>
Let me say a word to President Barroso. I was particularly surprised by his outburst yesterday here in this Chamber. To suggest that somehow we take great delight in the problems facing the euro is, frankly, absurd. Do you honestly believe that we are pleased to see so many people suffer as a result of your political project? I have merely many times set out the options for the eurozone as I see them: either an effective fiscal union or a reduction in the size of the eurozone. At the moment you are trying to move towards a political union without the fiscal union that is really required, and I think that it is entirely reasonable that we should raise the alarm about what this will mean for national democracy in many Member States.</p><p>
</p><p>Whether or not the euro survives, what is important for me is that those countries that had the good sense to stay out of it are not hampered by the decision of 17 to go ahead with more integration, if indeed that is what they choose to do. But of course, the one tool that must always remain the equal property of the 27 countries is the single market. It is the one thing that we all support, and I was therefore delighted see that the Cyprus Presidency has said that one of its ambitions is the deepening of that internal market. You will have our full support in that aim.</p><p>
</p><p>The Presidency will also conclude negotiations on the Capital Requirements Directive. Yesterday, as part of his criticisms, President Barroso pointed out – correctly – the UK’s significant bank bailout commitments made under our previous, Socialist, government. I agree with him that we should ensure that banks are sufficiently capitalised to present this from ever happening again. So why, then, is the Commission still trying to water down the commitments the EU made in Basel to implement the Capital Requirements Directive? Mr Barroso, my group, and indeed the UK Government, is in favour of more stringent bank regulation than your Commission. We want to make sure that taxpayers never again have to bail out the banks.</p><p>
Turning very briefly to the multiannual financial framework, it still continues to baffle me how the Commission can enforce austerity on Member States and simultaneously demand more money from them for the EU budget. It seems that everyone has to cut spending, apart from the European Commission.</p><p>
</p><p>The idea that throwing money at economic problems and hoping it will make them go away is surely a doctrine that was discredited in the 1970s. If the Presidency can truly deliver a budget that genuinely focuses on quality and added value, and on better spending rather than on more spending, you will indeed have our full support.</p><p>
    </p>",mr presid let first thank presid christofia speech today welcom gave group recent visit cyprus great appreci construct meet govern clear go much common polit nevertheless appreci courtesi hospit also agre implic presid prioriti eu seen relev mani citizen need becom effect effici posit group clear want see eu fail continu pursu agenda past sure let say word presid barroso particular surpris outburst yesterday chamber suggest somehow take great delight problem face euro frank absurd honest believ pleas see mani peopl suffer result polit project mere mani time set option eurozon see either effect fiscal union reduct size eurozon moment tri move toward polit union without fiscal union realli requir think entir reason rais alarm mean nation democraci mani member state whether euro surviv import countri good sens stay hamper decis go ahead integr inde choos cours one tool must alway remain equal properti countri singl market one thing support therefor delight see cyprus presid said one ambit deepen intern market full support aim presid also conclud negoti capit requir direct yesterday part critic presid barroso point correct uk signific bank bailout commit made previous socialist govern agre ensur bank suffici capitalis present ever happen commiss still tri water commit eu made basel implement capit requir direct mr barroso group inde uk govern favour stringent bank regul commiss want make sure taxpay never bail bank turn briefli multiannu financi framework still continu baffl commiss enforc auster member state simultan demand money eu budget seem everyon cut spend apart european commiss idea throw money econom problem hope make go away sure doctrin discredit presid truli deliv budget genuin focus qualiti ad valu better spend rather spend inde full support,en
Danish Presidency of the EU marked by ‘typically Danish efficiency and practicality’,03-07-2012,European Parliament,Martin Callanan,446,"<p>
	</p><p>– Mr President, I want to do two things this morning.</p><p>
First of all, I want to wish the Secretary-General of Parliament a very happy birthday. I am sure he is delighted to be having to spend his birthday listening to us drone on in this Chamber. Secondly, and much more importantly, I would like to thank the Danish Presidency, their officials and ministers and all those whom we have dealt with over the last six months.</p><p>
Of course, Prime Minister, as a Socialist while I myself am a Conservative, I am sure there are many issues on which we would disagree. However, I would like to pay tribute to the typical Danish efficiency and practicality which has been sorely needed in the EU over the last six months. In particular your Presidency should be congratulated for burying the financial transactions tax as an EU-wide initiative. It would have damaged many of the EU’s financial centres, and many ordinary savers and investors as well.</p><p>
Your administration should also be thanked for refusing to reopen negotiations on the Pregnant Workers Directive, which would have raised costs for businesses, reduced women’s choice and made it harder for many young women to find jobs. You should also be congratulated as a member of the EU net contributors club for pushing for budget restraint within the EU as well.</p><p>
</p><p>In fact when I look at many of the policy areas, it seems there are many lessons that you could teach the wider Socialist family about the responsibilities of power should you ever choose to come back to this Parliament.</p><p>
</p><p>Regarding the row over the Schengen evaluation mechanism, I have to say you have my sympathy on this. After all, the decision to change the legal base was made unanimously by the Council – a Council which, as Mr Daul and others often remind us, is made up predominantly of leaders of the EPP. I think it is very unfair that the messenger should be shot over this incident.</p><p>
</p><p>That aside, I think the Danish Presidency’s overall relationship with Parliament has been extremely good and I would like to thank in particular your Europe Minister sitting behind you, Mr Wammen, for all the work that he has done. He sat there tirelessly day after day in this Chamber, having to listen to a lot of brickbats and criticisms. I think he has done it extremely well, extremely courteously, and I am sure he has a great future ahead in your government.</p><p>
</p><p>Prime Minister, overall your Presidency has been a good honest broker between the institutions and we come away with a positive assessment of Denmark’s time at the helm.</p><p>
    </p>",mr presid want two thing morn first want wish secretarygener parliament happi birthday sure delight spend birthday listen us drone chamber second much import would like thank danish presid offici minist dealt last six month cours prime minist socialist conserv sure mani issu would disagre howev would like pay tribut typic danish effici practic sore need eu last six month particular presid congratul buri financi transact tax euwid initi would damag mani eu financi centr mani ordinari saver investor well administr also thank refus reopen negoti pregnant worker direct would rais cost busi reduc women choic made harder mani young women find job also congratul member eu net contributor club push budget restraint within eu well fact look mani polici area seem mani lesson could teach wider socialist famili respons power ever choos come back parliament regard row schengen evalu mechan say sympathi decis chang legal base made unanim council council mr other often remind us made predomin leader epp think unfair messeng shot incid asid think danish presid overal relationship parliament extrem good would like thank particular europ minist sit behind mr wammen work done sat tireless day day chamber listen lot brickbat critic think done extrem well extrem courteous sure great futur ahead govern prime minist overal presid good honest broker institut come away posit assess denmark time helm,en
Callanan: The EU faces another crisis of legitimacy,13-06-2012,European Parliament,Martin Callanan,504,"<p>
	</p><p>– Mr President, Europe is facing yet another in its long line of crises, only this time, in my view, it is fast becoming a crisis of the legitimacy of the EU itself.</p><p>
Many of us warned that a monetary union with a light touch, which was envisaged in the Maastricht Treaty, could not work and, for a single currency to succeed, significant centralisation of power would be required – a centralisation which for many of us was totally unacceptable. That is where the EU finds itself today. It is bringing more centralisation upon itself in what is an increasingly desperate attempt to get ahead of the crisis, which so far it has completely failed to do.</p><p>
</p><p>When the markets are unimpressed, when the Spanish banks are lent EUR 100 billion, then there is a clear signal that the failure is continuing. This latest Spanish bailout lasted barely 24 hours before it was, as Mr Verhofstadt said, being questioned on the markets. If I can use a somewhat crude analogy, it is a little bit like wetting your pants at the North Pole. At first it feels warm and comforting but very quickly you realise just how much trouble you are in fact in.</p><p>
</p><p>Let me make two points. First, it would be unacceptable that the measures it is proposed we take should fall upon those who proposed originally to steer clear of this risky venture and, second, those countries who signed up to join a single currency with one set of governing rules should not now be obliged to join a single currency with a completely different set of governing rules. So those countries that are not yet in the euro should be released from their obligation to join.</p><p>
</p><p>Over the last 20 years, the EU has become ever more out of touch with public opinion, and that has shown in many recent elections and referendums. The people of Europe are becoming increasingly worried about centralisation, and about the remoteness of those who are gaining more power in the EU by the day. In no area is this seen more starkly than the management of the EU budget. The Commission talks about synergies, about investments, about added value, and the public just sees waste, mismanagement and fraud.</p><p>
An even bigger budget is being requested. The public just wonders why it is that for 17 years in succession the budget has been implemented with significantly high levels of illegal or irregular payments. People here are complaining that the concept of value for money is somehow getting in the way of European solidarity. The public just wonders how on earth one can justify wanting even more money when the money already being spent is spent so badly.</p><p>
</p><p>To win back public legitimacy and regain trust the EU needs to take reform seriously, it needs to respond to the needs of the people and not impose ideas upon them. Make no mistake, when we are facing so many different crises on so many fronts, we are very fast running out of time.</p><p>
    </p>",mr presid europ face yet anoth long line crise time view fast becom crisi legitimaci eu mani us warn monetari union light touch envisag maastricht treati could work singl currenc succeed signific centralis power would requir centralis mani us total unaccept eu find today bring centralis upon increas desper attempt get ahead crisi far complet fail market unimpress spanish bank lent eur billion clear signal failur continu latest spanish bailout last bare hour mr said question market use somewhat crude analog littl bit like wet pant north pole first feel warm comfort quick realis much troubl fact let make two point first would unaccept measur propos take fall upon propos origin steer clear riski ventur second countri sign join singl currenc one set govern rule oblig join singl currenc complet differ set govern rule countri yet euro releas oblig join last year eu becom ever touch public opinion shown mani recent elect referendum peopl europ becom increas worri centralis remot gain power eu day area seen stark manag eu budget commiss talk synergi invest ad valu public see wast mismanag fraud even bigger budget request public wonder year success budget implement signific high level illeg irregular payment peopl complain concept valu money somehow get way european solidar public wonder earth one justifi want even money money alreadi spent spent bad win back public legitimaci regain trust eu need take reform serious need respond need peopl impos idea upon make mistak face mani differ crise mani front fast run time,en
Callanan: EU summit failing to address collapse in competitiveness,22-05-2012,European Parliament,Martin Callanan,769,"<p>
	</p><p>– Mr President, we are having yet another European summit. I make it the 22nd that we have had in the last two and a half years. Mr Verhofstadt said it was the 18th but it would not be the first time that he has got his numbers wrong!</p><p>
I do not know what else Mr Van Rompuy has done, but he has certainly been very good at calling summits. None of the others have made any material difference so why, we ask ourselves, should this one? The reason that they have all so far failed is that none of them has addressed the real problem which, of course, is the collapse of European competitiveness. I think all of us in this House have a common objective. We all, of course, want the old mantra of growth and jobs, yet we have very different views on how that should be achieved.</p><p>
</p><p>For the socialists, across several groups in this House, only more government spending can create growth. I fundamentally disagree. The socialist vision of growth is an illusion created at the expense of borrowing and tax rises, and it is totally irresponsible in the current climate. As my favourite politician, Margaret Thatcher, once said, the problem with socialism is that eventually you run out of everybody else’s money. We cannot afford a return to the discredited socialist growth agenda of Keynesianism dressed up as more investment.</p><p>
</p><p>Economic growth does not need state intervention. In fact, very often state intervention actually restricts growth. Take, for example, the Agency Workers Directive. This well-meaning piece of legislation, introduced through this House, has resulted in a fall in the number of temporary workers being employed in France. The Working Time Directive actually stops people from working. In a crisis, it is utterly immoral. So-called social protection legislation in the EU is failing to protect us from the worst social injustice of all, which is unemployment. We risk having the best protected workforce in the world, but no workers.</p><p>
</p><p>More flexible labour markets are the way forward. EU leaders should ask which employment directive they can repeal immediately.</p><p>
We also need, as others have said, a bonfire of red tape. Each piece of additional legislation acts like a pin in the body of our economy. It can survive a few, but eventually it will be killed by a thousand pinpricks. The Commission’s inertia-driven ‘better regulation’ agenda should be replaced by a politically driven deregulation agenda, and this Parliament can play a role here by spending more of our time considering how to repeal, refine and reform existing measures. The EU needs to do less and it needs to do it better.</p><p>
</p><p>I have talked about what we can do less of. What can we do better? Commissioners, the answer lies in the letter signed by 12 Heads of Government. They sent you a clear set of ideas for extending the single market, for pursing free-trade agreements, for a European research area, and no end of good proposals. Sadly, the reaction from Presidents Barroso and Van Rompuy was disappointing. They continue to fall back on the Europe 2020 agenda.</p><p>
That agenda is lacking because it tries to be all things to all men. It contains some things to appeal to a liberal conservative like me, it has parts to appeal to socialists like Mr Swoboda, and even parts to appeal to a social democrat like Mr Verhofstadt. There are probably no parts that appeal to Nigel Farage, but then again the Commissioners are not miracle workers. Europe 2020 will not work unless it learns the lessons of the failed Lisbon strategy, which did not achieve its primary goal.</p><p>
</p><p>My message to the Commission is this: we need a strong, free-trade, pro-competition agenda from you. At the moment, the Commission is effectively rudderless. The letter showed you the way forward and yet you disregarded it. The reform that the EU needs will not come about from one additional dinner, but tomorrow’s meeting can make an important start. It should give the Commission a clear message that it wants to see a free-trade, deregulatory and pro-market agenda. It should tell the Commission to go away and rethink the next seven-year budget so that every euro focuses on added-value outputs, rather than simply increasing national contribution inputs. Most importantly, it should place the single market at the heart of our economic recovery. Unless we resolve our competitiveness crisis, we will never resolve the many other crises facing the EU.</p><p>
</p><p>How many more dinners and summits will it take before we actually get some action that will make a difference?</p><p>
    </p>",mr presid yet anoth european summit make nd last two half year mr said th would first time got number wrong know els mr van rompuy done certain good call summit none other made materi differ ask one reason far fail none address real problem cours collaps european competit think us hous common object cours want old mantra growth job yet differ view achiev socialist across sever group hous govern spend creat growth fundament disagre socialist vision growth illus creat expens borrow tax rise total irrespons current climat favourit politician margaret thatcher said problem social eventu run everybodi els money cannot afford return discredit socialist growth agenda keynesian dress invest econom growth need state intervent fact often state intervent actual restrict growth take exampl agenc worker direct wellmean piec legisl introduc hous result fall number temporari worker employ franc work time direct actual stop peopl work crisi utter immor socal social protect legisl eu fail protect us worst social injustic unemploy risk best protect workforc world worker flexibl labour market way forward eu leader ask employ direct repeal immedi also need other said bonfir red tape piec addit legisl act like pin bodi economi surviv eventu kill thousand pinprick commiss inertiadriven better regul agenda replac polit driven deregul agenda parliament play role spend time consid repeal refin reform exist measur eu need less need better talk less better commission answer lie letter sign head govern sent clear set idea extend singl market purs freetrad agreement european research area end good propos sad reaction presid barroso van rompuy disappoint continu fall back europ agenda agenda lack tri thing men contain thing appeal liber conserv like part appeal socialist like mr even part appeal social democrat like mr probabl part appeal commission miracl worker europ work unless learn lesson fail lisbon strategi achiev primari goal messag commiss need strong freetrad procompetit agenda moment commiss effect rudderless letter show way forward yet disregard reform eu need come one addit dinner tomorrow meet make import start give commiss clear messag want see freetrad deregulatori promarket agenda tell commiss go away rethink next sevenyear budget everi euro focus addedvalu output rather simpli increas nation contribut input import place singl market heart econom recoveri unless resolv competit crisi never resolv mani crise face eu mani dinner summit take actual get action make differ,en
